RequestId,EnrollmentCode,EnrollmentId2,EnrolleeFirstName,EnrolleeLastName,EnrolleePhone,EnrolleeGender,EnrolleeEmail,EnrolleeAddress,FulfilmentStatus,PharmacyCode,PharmacyName,IsPharmacyPaid,HasPartnerPaid,PartnerCode,FulfilmentService,ServiceCharge,CreatedBy,AssignedTo,CreationMode,Diagnosis,Notes,InternalNotes,ProcessedDate,PreAuthorizationCode,UseSortingCenter,DateCreated,DateUpdated,PickUpDate,EnrolleeDateOfBirth,PickUpCode,PartnerName,DiagnosisCode,TicketId,EnrollmentId,ExternalPickupCode
411768,RDS/019/A/00655/SPT-003,,OKO-UKONI ,ZOEY,2348131544712,3,,"16,OGUNNAIKE STREET PALMGROVE",6,WHP10107,Drug Consult,true,false,WHPX10132,2,145,gift@wellahealth.com,gift@wellahealth.com,1,Nil,,,"November 17, 2024, 3:42 PM",,false,"November 17, 2024, 3:40 PM","November 17, 2024, 3:42 PM","November 17, 2024, 3:42 PM",,17228698,SPRINGTIDE HEALTHCARE SERVICES LTD,,,,
412420,AVM/BY/044/C/00093/SPT-003,,Abiye ,Jacob,2348129489807,3,,"Anibros filling station, Nkpor road, opposite st John's. Iwofe road.  ",6,WHP10646,Chilison pharmaceutical company Limited,true,false,WHPX10132,2,85,ime@wellahealth.com,ime@wellahealth.com,1,nil,,,"November 18, 2024, 3:29 PM",,false,"November 18, 2024, 3:27 PM","November 18, 2024, 3:29 PM","November 18, 2024, 3:29 PM",,21165890,SPRINGTIDE HEALTHCARE SERVICES LTD,,,,
412427,AVM/AER/004/C/0026/SPT,,Ukut ,Joshua,2347016671821,3,, House address: 23 Joaquim Way off omololu street randle avenue surulere Lagos,6,WHP11418,Vatican Pharma Surulere,true,false,WHPX10132,2,242.51,gift@wellahealth.com,gift@wellahealth.com,1,nil,,,"November 18, 2024, 3:38 PM",,false,"November 18, 2024, 3:33 PM","November 18, 2024, 3:38 PM","November 18, 2024, 3:38 PM",,75377087,SPRINGTIDE HEALTHCARE SERVICES LTD,,,,
415341,RTES/067/C/00001/SPT-001,,AKINSANYA,ADEDAPO ,2348033544473,3,,"37, Funsho George Street, off Amusan road, Puposola, Lagos",6,WHP10757,"Shekinah Pharmacy (Olaniyi, New Oko-Oba)",true,false,WHPX10132,3,153.75,sophie@wellahealth.com,sophie@wellahealth.com,1,HTN,,,"November 22, 2024, 4:03 PM",,false,"November 22, 2024, 4:02 PM","November 22, 2024, 4:03 PM","November 22, 2024, 4:03 PM",,11560111,SPRINGTIDE HEALTHCARE SERVICES LTD,,,,
416712, RDS/019/A/00655/SPT/001,,OKOUKONI ,ELIZABETH,2348022771273,3,,"16, OGUNNAIKE STR PALMGROVE B/STOP",6,WHP10107,Drug Consult,true,false,WHPX10132,2,175,mabel@wellahealth.com,mabel@wellahealth.com,1,nil,,,"November 25, 2024, 2:17 PM",,false,"November 25, 2024, 12:47 PM","November 25, 2024, 2:17 PM","November 25, 2024, 2:17 PM",,21265462,SPRINGTIDE HEALTHCARE SERVICES LTD,,,,
420433,RDS/019/A/005040/SPT-002,,Omole ,Precious Oyindamola,2348077985673,3,,"15 Salvation army street, okeakwa, Isolo, Lagos",6,WHP11414,Aerial Care Pharmacy,true,false,WHPX10132,2,162.5,mmeyene@wellahealth.com,mmeyene@wellahealth.com,1,NA,,,"November 30, 2024, 6:04 PM",,false,"November 30, 2024, 6:03 PM","November 30, 2024, 6:04 PM","November 30, 2024, 6:04 PM",,31374643,SPRINGTIDE HEALTHCARE SERVICES LTD,,,,
